,Job Title,Company,City,Description,Days On Indeed,URL
209,Management Analyst,Rigil Corporation,"Alexandria, VA 22311 (Alexandria West area)",Establishing internship and student-level programs. This role will serve to support the Workforce Development Initiative for the FAA AIT Workforce Development…,16,www.indeed.com/rc/clk?jk=2a668f8a158632fa&fccid=9a3099696e9e959e&vjs=3
210,Market Research Analyst,Penn Schoen Berland,"Alexandria, VA 22311 (Alexandria West area)","In particular, the Analyst will be responsible for: Our ideal candidate has a Bachelor’s degree and internship or summer work experience in public relations,…",17,www.indeed.com/rc/clk?jk=5588effd1abdae2b&fccid=f9cd16307b0fe8ec&vjs=3
211,Analyst - Artificial Intelligence & PoS Platforms,AskBlue,"Alexandria, VA 22311 (Alexandria West area)",Streaming Data and Messaging. Job Title: Analyst - Artificial Intelligence & PoS Platforms. Ensure Guest Data is always encrypted at rest and in transit.,17,www.indeed.com/company/AskBlue/jobs/Analyst-263da4419248c9f2?fccid=3f8c6c29ae3780e9&vjs=3
212,"Undergraduate Intern, Corporate Financing",Finra,"Alexandria, VA 22311 (Alexandria West area)","To be considered for our Summer Internship Program, please submit the following to the Internship opportunity that is the best match to your ambitions:",18,www.indeed.com/rc/clk?jk=2e6497eab3874377&fccid=b7e7351d21700e06&vjs=3
213,"Undergraduate Intern - Fraud Surveillance- Business, Finance...",Finra,"Alexandria, VA 22311 (Alexandria West area)","The Summer Internship Program runs from May 18, 2020 through August 7, 2020. The intern will assist analysts and managers with the investigative processes,…",16,www.indeed.com/rc/clk?jk=62a75e876b76e954&fccid=b7e7351d21700e06&vjs=3
214,Security Analyst – Developmental,CACI,"Alexandria, VA 22311 (Alexandria West area)",As a Security Analyst Assistant a typical day might include the following: Reviews the results of all security processing to glean necessary facts and data…,17,www.indeed.com/rc/clk?jk=f9f28e28da113629&fccid=290a4498a64fc044&vjs=3
215,Security Analyst – Senior,CACI,"Alexandria, VA 22311 (Alexandria West area)",Reviews the results of all security processing to glean necessary facts and data relevant to the final recommendation. High school diploma or GED.,17,www.indeed.com/rc/clk?jk=704ef2269188bdae&fccid=290a4498a64fc044&vjs=3
216,Data Analyst I,CNA Corp.,"Alexandria, VA 22311 (Alexandria West area)","Conduct Exploratory Data Analysis (EDA) to include the use of data visualizations (e.g. Dash, MATPLOTLIB, R Shiny, ggplot2, Power BI, etc.), correlations,…",22,www.indeed.com/rc/clk?jk=8ff9f7688dda0570&fccid=ad630b096ddaaad7&vjs=3
217,2020 Entry Level - Assoc Intl Trd Cmplnce Analyst - Falls Ch...,Northrop Grumman,"Alexandria, VA 22311 (Alexandria West area)",Northrop Grumman is seeking International Trade Compliance Analyst 1 (ITC Rotation Program). Establishes operational processes for assuring trade compliance…,25,www.indeed.com/rc/clk?jk=e061edcc9f76e1d7&fccid=11619ce0d3c2c733&vjs=3
218,Librarians-in-Residence,US Legislative Branch,"Alexandria, VA 22311 (Alexandria West area)","The program is managed by Internship and Fellowship Programs, Library Collections and Services Group. The geographical information system (GIS) team provides…",22,www.indeed.com/rc/clk?jk=6080a9f726cc711c&fccid=4cc2cf9a59c8d6b9&vjs=3
219,HR Employment Sourcing Analyst,Allstate,"Alexandria, VA 22311 (Alexandria West area)","Gathers and synthesize market, candidate and industry data. The Sourcing Analyst is responsible for sourcing strategies for a specific client group.",25,www.indeed.com/rc/clk?jk=21ae55142139fee5&fccid=3a71a4d2f7990a25&vjs=3
220,Account Management Associate,Hanover Research,"Alexandria, VA 22311 (Alexandria West area)","You have 0 - 2 Years of Full-time or Part-time Customer Service Experience; previous leadership, professional, and or internship experience.",24,www.indeed.com/rc/clk?jk=e39c0c75af88df94&fccid=c0a6d53fc272653b&vjs=3
221,Research Analyst - Space Systems,Institute for Defense Analyses,"Alexandria, VA 22311 (Alexandria West area)","Demonstrated ability to identify sources, assemble, and organize data sets for which subsequent quantitative and qualitative analyses is desired.",25,www.indeed.com/rc/clk?jk=82af18e057ce6de1&fccid=4e69f24625edd7db&vjs=3
222,Intern - Risk and Foresight Group (Spring 2020),Center For Strategic And International Studies,"Alexandria, VA 22311 (Alexandria West area)","This unit is charged with focusing CSIS’s cross-cutting analysis in mid- to long-term futures, as well as innovative use of foresight methodologies such as data…",28,www.indeed.com/rc/clk?jk=fba0860edc25a232&fccid=a8944406753ba1dc&vjs=3
223,Technology Analyst - Intern,Systems Planning and Analysis,"Alexandria, VA 22311 (Alexandria West area)",Excellent data gathering and analysis skills. Technology Analyst interns will have a unique opportunity to develop cutting edge methodologies for identifying…,30+,www.indeed.com/rc/clk?jk=70056734653b51d6&fccid=ccfce62820936877&vjs=3
224,Junior Quality Engineer,mgm technology partners,"Alexandria, VA 22311 (Alexandria West area)",Effectuate high-quality test data preparation (either for data imports or manual data entering). Prior work or internship experience.,30+,www.indeed.com/rc/clk?jk=6503230cfb018dcf&fccid=9cfaa7d22ab1d626&vjs=3
225,Senior Dynamics CRM Architect,Buchanan & Edwards,"Alexandria, VA 22311 (Alexandria West area)",Build data migration and integration mappings as needed. Implement data integrations with applications on premise and in the cloud.,29,www.indeed.com/rc/clk?jk=a226c02f31ba6aa6&fccid=ede552e94c87091b&vjs=3
226,Data Analyst-Summer Internship,"Systems Planning and Analysis, Inc.","Alexandria, VA 22311 (Alexandria West area)","This internship position will assist the Australian Maritime Analysis Group (AMAG) with refining, running and post-processing agent-based models.",5,www.indeed.com/pagead/clk?mo=r&ad=-6NYlbfkN0A9iRlroMm07lYYI3dFCEt8cETOqHrMaOLrsdITsZByvSJGGsIEEccsJw2Nbvm3ZC8zQnYvB-f6CRHH4KO9kU1BJepe2HE9glZhpHYbWbkdz3D96F1Oh0VDCeYitXlJCO-FTmzHaLc2UEb6LY-tQ51b40sucRNbrayNLgbpm01UX4te97cSPxITIqqS-w8XnDObA8eIjq0ChN569A82wT5G9Icyeup3k-A1D6IcV2_eB5lQp09za8FacBy9pl5DHHBNgwhoe5cHB1l1Ta5uhyNmAC1Y-8NlTwsKfd3IxDpoEyLtdCPIOp8kSphTIqT0ieFBQFqj29DS3lW0FzCCDY1boZQCoiETD55Subum6J_2ZOdpr0RJHVX466SnmW5aeRQwyAygSbFPCSUCz0w-sf74xrpDA1ZhRUieZOYXOu2kETxZvBvc1IluFdRbLFoo9EOkD1J7vbnKMj3JOF__Net-j8ym6o92N-kRld4HHoe-Q_IVLFsNAYDQ8LMQq2E8G-ATNQa_9d0jmsZxg-Q-9omPeGzzSqedeKwdLVQ1HX9IJa8xRidU_p3s_AIJycxMdFbimKw6QIcG2rkUI63zKcRt_8fs8SvMLmYtrqm73jomPjR-s6oICxIOAN5XMih6npDeyj1JABVhgWbXCjr6Fj7j-m2IvrR6_nShvu9-gWrt1f2QpcvFJ74p&p=10&fvj=0&vjs=3
227,Product Strategy Analyst,GEICO,"Alexandria, VA 22311 (Alexandria West area)",Preference is given to candidates with related work or internship experience. A typical day may include using various programming languages to analyze sales and…,30+,www.indeed.com/cmp/Geico
228,Undergraduate Internship/Co-op Program - Data Scientist,Central Intelligence Agency,"Alexandria, VA 22311 (Alexandria West area)","As a Data Scientist Undergraduate Intern for the CIA, you will work side-by-side with other Data Scientists to organize and interpret data to inform US decision…",30+,www.indeed.com/pagead/clk?mo=r&ad=-6NYlbfkN0AF-trXmOgtyCwioKtrEl8yaVFL4BmZPgj5ekSBDDCZjYyztgCjYk9Nn1Yk0fikpBCXlbJRto7tbhTNs_8jWhl66WDYF0blksRUITtN7f7We8gX1ulbHIFEbi7O9bLDyp74vfjAdx17fhIKaZ1MUdiR8-dohfXf4dPYOfFIM6iv3IE5UMhpR4Zlr--k394aWMFXGMMY9-cANex8ZyR5qgRCFNjTbeK-9LxUzN3A4DBStOmxq7a9ArzLx1f0rzK6qiP8BL8Yl-u9GaI-VW3DCGCiKCe2jnKeeA8G0S46axm4d_TGsxBY9VeVyyOL_NPho_uPgPtbbb2DsQ12Vky46CSets47JXk0R7aeLW1dc2U6PCUbiMB6NTuwFUyEBm2OCCqq_yPZ3RsYoAjRcSQ09FGu4Rxk2Cq5Nz7PjIBGhdOPEEzE5ZY29W2WS97Xsb02Cb94bdMMnrU61aviFy-_dhkAwd6ChdkcjiudXXzN7M5DdbanIZF9pcCgBJM8NqJPH37WQe9vdDIOKa35BTbSI2dq&p=12&fvj=0&vjs=3
229,Data Scientist,Central Intelligence Agency,"Alexandria, VA 22311 (Alexandria West area)","As a Data Scientist for the CIA, you will organize and interpret data to inform US decision makers, drive successful operations and shape CIA technology and…",30+,www.indeed.com/pagead/clk?mo=r&ad=-6NYlbfkN0AF-trXmOgtyCwioKtrEl8yaVFL4BmZPgj5ekSBDDCZjZycesTIQYxFSJWWs_8HUdDB9hwnbzKrEDmqNEQWLfwRG9GenFiLzX9NjSKXd29GoPxByddGgCwKJYfyC_zQmmOKYurIfyNb0Bi_9DTQbXlY-wGT1MDWens1AdxQPyBrFlo0gjlcys794our6jh4t02-0ogNYXeNP9OlmkLKcQYN0-ad2y8kY-GA6jgqyl40WsDFvg_MbUyoJar4xEhmsobtdAd5BwawmNrPFAp9WrrxHxGfrBLjZygHNRq4OAQRd0o0eI1_SccxJJWWtUurXrNLSP6GuB9jf9MBfmLKF5XwYtLLeo7BICOO3j3gjDMrLYmHcLVq-o9vBX7kcJii-RXBAr6YVmpNTkBrd5SbKflDnq-MgCw42Wlv946XQdStRZJtLyq5zR0-agocX285mPGiPfjKIghfOrXnpWIt08qUmhj6xf_mh94QQRk259_3zK16-UMFegc0&p=13&fvj=0&vjs=3
230,Data Scientist - Intern (Summer 2020),"Systems Planning and Analysis, Inc.","Alexandria, VA 22311 (Alexandria West area)","Experience with preprocessing varied and unstructured data. Experience with common data science tools such as Python, R, or other scripting language.",5,www.indeed.com/pagead/clk?mo=r&ad=-6NYlbfkN0A9iRlroMm07lYYI3dFCEt8cETOqHrMaOLrsdITsZByvSJGGsIEEccsJw2Nbvm3ZC8zQnYvB-f6CZm4ncnQAgJBalJd4epOKCPVLCsz9XApoyvvhkTqjzs7tQ5k5euUtOYu2cf5rIjvaZo3ykQ8-lHGalw9hgnnRyOPfgaQVIfj8vVJ66mZwGhqzR0gOA0H5fl7EsoJriloh4G044fp9RcHqYxU3Wmi29v77SuoY2-syc9_NTVKxgx-id_17sNCoYVqvUnDcnvOBA9dnd1bbWnH3Yyxlx8ExrbhqmC7DZdrdhRzKhvTJBF5W9GxcyFEYrN2ddiHmL9N_pOI6bD4FdS63PBij-0QCtPOepmb1kZZ6Dthv6EJFU-6cG3doDCVlDRkrpzRG6JtnsKBkW3NFINSiyoOidmgSH-8Bwy37nrWCo0nKY9jS9mFZWUbkpoSCxBg9Gb7EL-rDLi1wMBzbsRWKs5OvNHWKupFI3uEIEFmnp0_fUVQKna2Z3DRqFh8ERX4-9i3s_XHNa9cH8TxBecp5TvZWXAuymSdsX9MByBq4jSHZVydr30OQ-4VcKbiA-mO8EFsDQIB_KzSTswDIqibDfMj7iIW3D59OCvp37V6IY0Lh8c3p3NFFHjWD6RrmF7s91Lva4fxlt3vDyf6xk6YqbK3LAnypiQxzqm7uKc_zDWBOIEcIArP&p=14&fvj=0&vjs=3
231,Data Scientist - Intern (Summer 2020),"Systems Planning and Analysis, Inc.","Alexandria, VA 22311 (Alexandria West End area)","Experience with preprocessing varied and unstructured data. Experience with common data science tools such as Python, R, or other scripting language.",5,www.indeed.com/pagead/clk?mo=r&ad=-6NYlbfkN0A9iRlroMm07lYYI3dFCEt8cETOqHrMaOLrsdITsZByvSJGGsIEEccsJw2Nbvm3ZC8zQnYvB-f6CZm4ncnQAgJBalJd4epOKCPVLCsz9XApoyvvhkTqjzs7tQ5k5euUtOYu2cf5rIjvaZo3ykQ8-lHGalw9hgnnRyOPfgaQVIfj8vVJ66mZwGhqzR0gOA0H5fl7EsoJriloh8mieOfaVlIiTWCHmc9QvhH8raSz1zMK8MU8xPiLeJVZk77RVSXqO00SNFdAptKydWR-rgsUJcvD2FAnLKBIu5e9iQWu11OPYZo1NHmkgfZ2XHGHmV3coMVltKL5WLkF41Dl4qFv5KYaGVg_dkHfDi5pVBJEu7f9SM7kdBGFRniMesu7_SXiviMmUXLuzqvTgiaNKDN6AYb5WKDyOorWZTIZ-L0nNht3WQvVa22rq9DJ7VdO0zbYv791OInQ3lI-g1Ijqw7N9TpW1vBoOTeetPCaQspLkOA_y7j7At9dLfYreyRlfuGr1rhXfcQDyK8Yh0nljIv96A02aXM4osNWLsfLY8DGibwCEJ8s8c7rhxxnL1D7jxqe2_7SlFwkO5bHISSpvzm4H7hToFhr2-TyUbiDmG9Xu-9gVCY7Hat7KiJoNPb1oM9ZlVYtVBHhiVAqyu55VDlP-w6SOnKlaC76-eIlxO9i6GHXLBKQ0HbvbgOz&p=0&fvj=0&vjs=3
232,Data Analyst-Summer Internship,"Systems Planning and Analysis, Inc.","Alexandria, VA 22311 (Alexandria West End area)","This internship position will assist the Australian Maritime Analysis Group (AMAG) with refining, running and post-processing agent-based models.",5,www.indeed.com/pagead/clk?mo=r&ad=-6NYlbfkN0A9iRlroMm07lYYI3dFCEt8cETOqHrMaOLrsdITsZByvSJGGsIEEccsJw2Nbvm3ZC8zQnYvB-f6CRHH4KO9kU1BJepe2HE9glZhpHYbWbkdz3D96F1Oh0VDCeYitXlJCO-FTmzHaLc2UEb6LY-tQ51b40sucRNbrayNLgbpm01UX4te97cSPxITIqqS-w8XnDObA8eIjq0ChCcsCj-tzfunS0KbFekRKZjlhZ5AYLMBtTjRudBrY8b_42K-3mPVUSGgxTFg85aoAPmi_t-zl668IorAguwayAxzsXJZfWvfA2PovqsvTToq4EiM7i-L7Clpe_o_pDkwk-5Hyu25hfeI1d2DbMtzXaeoByLoNspPgrLCNxcaJRizgaIKThqevM81cYhO31HsZlVLaq5x9lZ9hIMS9qsPfVthaIAW_CvPoP8SlDAQLmr4oOo-tZtx1hMzoxweNrNS_u73MprcxkLmiiVzfIAcN9xngiYm11KMxmZO2LW7PEmEDLSmEPkevLf2F9VUaOWwc39fbxhpp57cJ8yjdaQXHXbY4RGUgLahtt-T0KagZ9JxFwTgamiLENkLWXIH8w2ln1RSWbAwDEhG_nz1V3DuK9hC9Kvbz5oBU3NkoILr5cduuHXL6bNmpRybcntlG8szZ_bhJyVmw7tsu0XGMoHL9NxBj3vz_TjKoEwQea3IPyqI&p=1&fvj=0&vjs=3
233,Undergraduate Internship/Co-op Program - Data Scientist,Central Intelligence Agency,"Alexandria, VA 22311 (Alexandria West End area)","As a Data Scientist Undergraduate Intern for the CIA, you will work side-by-side with other Data Scientists to organize and interpret data to inform US decision…",30+,www.indeed.com/cmp/Central-Intelligence-Agency
234,Product Strategy Analyst,GEICO,"Alexandria, VA 22311 (Alexandria West End area)",Preference is given to candidates with related work or internship experience. A typical day may include using various programming languages to analyze sales and…,30+,www.indeed.com/pagead/clk?mo=r&ad=-6NYlbfkN0Acjr3lGWLBzJnSLr0JOeIhnRJBIlNlnblRoY9-2yUkfHGYq_sNv_wD2zki-kn6Q0nsE7E_FVm-Sveab1NCQl2va5-vVTGhtPNPocs3TviSfyLsRoI3a-yWibfHaX6T2Io2NGId6xbz2JsWUMxCWbX1MB35Sj9PHoTJ7T_mi4SffW7TmPhEWBLBLUeASLmSSGTN6raLZYxbB_t_e0sOBs0JXEGFUf5WaIptPwnw_SGpyxg2-kILtnPmu3EOZiuU3RdUXSZQbFfjnbUzW4qzBhnb-9yMhyGHuHkRL6--Uydl2xHN2bneMFXcT_Hr-RrnIxpWu0V1kbPsQPmwQ3DRnVOHYi1m_Haj-SYQxg659kv90E_bc2HSLuctUj6LfBTLwpKh-IcoBgkYEC3OjaLCb6cpQ6v29h89E2CS7VzBgbRug2yE_cjd-3qtTn2DvPHWg7FGQinCJfU4rID1HGGelQsPFkftriYc_dEYBugFb1xNLJ7RLj9nyLHUMin7wdK7vAuiU6F-7AEMx4dm0oLj7b_7L9OzpEzOIQK_xkFjyKDYnw==&p=3&fvj=0&vjs=3
235,Data Scientist,Central Intelligence Agency,"Alexandria, VA 22311 (Alexandria West End area)","As a Data Scientist for the CIA, you will organize and interpret data to inform US decision makers, drive successful operations and shape CIA technology and…",30+,www.indeed.com/pagead/clk?mo=r&ad=-6NYlbfkN0AF-trXmOgtyCwioKtrEl8yaVFL4BmZPgj5ekSBDDCZjZycesTIQYxFSJWWs_8HUdDB9hwnbzKrEDmqNEQWLfwRG9GenFiLzX9NjSKXd29GoPxByddGgCwKJYfyC_zQmmOKYurIfyNb0Bi_9DTQbXlY-wGT1MDWens1AdxQPyBrFuiiYPuGVPn0hUpoUlb5u3rgZaFqk8GV8zI3crvk5FtztR2nD4fxCTClR5fec0NGfq3byDRwYaR_f9cX6F-bePkV8r5f7tIDgOd2w124QSgM1FRDbrAFZ-Xg7TlCI0whEzxkrCn7bIp28QGO5Bvfz_pzUBLbrKRMD2yJXBgoLtdi_fwsdg18yQNBi64RcFwKG-xG7Z8xALF1SU9BBEBbO4wEIGrMTT_N3U3JWDP9GqlVjonp1_K9ZfELd9AAbhkqcEjrITywCuIz_1U1xjvNlt2RYaAJb4a4DKUGlI41NLHShqIDoGWsrr8FPoXzvYZXK1tW4yNyDjSs&p=4&fvj=0&vjs=3
236,Internship Student - Unpaid - 15 hours per week,"Goel Services, Inc.","Alexandria, VA 22311 (Alexandria West End area)",Internship roles and duties must meet the following guidelines: The internship experience is for the benefit of the intern.,30+,www.indeed.com/rc/clk?jk=840de4cc8f0e4c5e&fccid=072dd39c2f1911b2&vjs=3
237,U.S. Treasury & Currency Analyst,Mitre Corporation,"Alexandria, VA 22311 (Alexandria West End area)",U.S. Treasury & Currency Analyst - (00054687). Every MITRE analyst is expected to: Candidates who have held internship positions supporting comparable business…,30+,www.indeed.com/rc/clk?jk=c3267df671df439f&fccid=fd03a1a845b02aae&vjs=3
238,Intern - Construction,Lidl US,"Alexandria, VA 22311 (Alexandria West End area)",Help in analyzing construction processes and requirements and support the development of corresponding process and data flows.,30+,www.indeed.com/rc/clk?jk=2e303c2fc3417512&fccid=d7896c8ad75bc8af&vjs=3
239,Software Developer Intern (Summer 2020),BAE Systems,"Alexandria, VA 22311 (Alexandria West End area)","Under direction of a Sr. Software Developer, you will develop software in an Agile environment that performs data collection/ingestion, data visualization, and…",30+,www.indeed.com/rc/clk?jk=5157f38e5f6adb58&fccid=200a825acadb9338&vjs=3
240,Research Intern - Trustee Chair in Chinese Business and Econ...,Center For Strategic And International Studies,"Alexandria, VA 22311 (Alexandria West End area)","The research intern makes supportive contributions to the research agenda of the Chairholder and research associate through research, data analysis, writing,…",30+,www.indeed.com/rc/clk?jk=8ab9820e8569169c&fccid=a8944406753ba1dc&vjs=3
241,Data Journalist Intern - 2020,Associated Press,"Alexandria, VA 22311 (Alexandria West End area)","Effective data analysis and reporting skills with a track record of developing strong story ideas from data. A solid foundation, either in solving problems with…",30+,www.indeed.com/rc/clk?jk=c4dd6a3377b12ffe&fccid=9be7acc637a1ef91&vjs=3
242,Analyst Internship,Novogradac & Company,"Alexandria, VA 22311 (Alexandria West End area)","This position reports to a designated Analyst or Manager on the GoVal team. This includes collecting and coalescing pertinent data, assisting in market analysis…",30+,www.indeed.com/rc/clk?jk=056f5688723cb97a&fccid=547dc8b84c011e64&vjs=3
243,Summer 2020-Data Analysis Intern,Center on Budget & Policy,"Alexandria, VA 22311 (Alexandria West End area)","Visit https://www.cbpp.org/careers/intern for more information about the Center's internship program. The Data Analysis team collects, prepares, and summarizes…",30+,www.indeed.com/rc/clk?jk=231b3773c65c2ce0&fccid=15792522ec488a38&vjs=3
244,"Security Analyst Intern, Threat Discovery",Facebook,"Alexandria, VA 22311 (Alexandria West End area)",Familiarity with Tableau or other data visualization tools. Work with outside experts to enhance internal data and investigations.,30+,www.indeed.com/rc/clk?jk=8d423256a13ad8f8&fccid=1639254ea84748b5&vjs=3
245,Research Intern- Human Rights Initiative (Spring 2020),Center For Strategic And International Studies,"Alexandria, VA 22311 (Alexandria West End area)","The start date for this internship is January 13, 2020. Maintain and update program data, including research materials and program mailing lists.",30+,www.indeed.com/rc/clk?jk=f34eaf008e260dca&fccid=a8944406753ba1dc&vjs=3
246,Research Intern- Human Rights Initiative (Spring 2020),Center For Strategic And International Studies,"Alexandria, VA 22311 (Alexandria West End area)","The start date for this internship is January 13, 2020. Maintain and update program data, including research materials and program mailing lists.",30+,www.indeed.com/rc/clk?jk=f34eaf008e260dca&fccid=a8944406753ba1dc&vjs=3
247,Intern - Technology Policy Program (Spring 2020),Center For Strategic And International Studies,"Alexandria, VA 22311 (Alexandria West End area)","Compiling research and data into literature reviews, summaries, backgrounders, and short publications to support the program’s research portfolio;",30+,www.indeed.com/rc/clk?jk=5848bb860495065c&fccid=a8944406753ba1dc&vjs=3
248,Intern - Burke Chair in Strategy (Spring 2020),Center For Strategic And International Studies,"Alexandria, VA 22311 (Alexandria West End area)",This internship will support the Burke Chair with research and administrative needs. Conducting qualitative and quantitative data research to be used in…,30+,www.indeed.com/rc/clk?jk=fb569e544a083d7f&fccid=a8944406753ba1dc&vjs=3
249,Research Intern - Defense-Industrial Initiatives Group (Spri...,Center For Strategic And International Studies,"Alexandria, VA 22311 (Alexandria West End area)","Assisting with data collection and management. The Defense-Industrial Initiatives Group (DIIG) is hiring a research intern for a 20- to 35-hour per week, paid…",30+,www.indeed.com/rc/clk?jk=7da90946fa1dc5f5&fccid=a8944406753ba1dc&vjs=3
250,Engineer/Analyst for ISRT Scientific Applications,Johns Hopkins Applied Physics Laboratory (APL),"Alexandria, VA 22311 (Alexandria West End area)","You will contribute to field tests andexperiments, including planning, execution, and data analysis. Have at least one year of work experience, or significant…",30+,www.indeed.com/rc/clk?jk=f17c712472bdc571&fccid=b8acc26118799f48&vjs=3
251,Strategic Internship Program - Data and Technology Strategic...,JPMorgan Chase,"Alexandria, VA 22311 (Alexandria West End area)","Demonstrates ability to develop data pipelines (i.e., ETL), data quality automation and evaluation, and data. Engage with analysts, Research Directors, Research…",30+,www.indeed.com/rc/clk?jk=8d6a6ff5b5d68801&fccid=aaf3b433897ea465&vjs=3
252,Junior Data Analyst,Boulevard Consulting Group,"Alexandria, VA 22311 (Alexandria West End area)","Experience with machine learning, data mining, statistics, or graph algorithms in an academic or internship environment.",30+,www.indeed.com/rc/clk?jk=4fd4ae6b3ba7776f&fccid=07c9da759d4e678a&vjs=3
253,Data Scientist,US Other Agencies and Independent Organizations,"Alexandria, VA 22311 (Alexandria West End area)","As a Data Scientist for the CIA, you will organize and interpret data to inform US decision makers, drive successful operations and shape CIA technology and…",30+,www.indeed.com/rc/clk?jk=05ccaa409d89f139&fccid=0e7e5fe9219fd5cd&vjs=3
254,Geospatial Analyst Intern,Maxar Technologies,"Alexandria, VA 22311 (Alexandria West End area)",Maxar is looking for a Geospatial Analyst Intern who has a passion for open source GIS data and technology to join our 2020 Summer Internship Program.,30+,www.indeed.com/rc/clk?jk=4283637824aa3a66&fccid=9f02eee31b134261&vjs=3
255,Geospatial Software Development Intern,Maxar Technologies,"Alexandria, VA 22311 (Alexandria West End area)","Solving unique issues holistically, especially where analysis of situations or data requires an in-depth evaluation of variable intangible factors.",30+,www.indeed.com/rc/clk?jk=00eb909dfc703a76&fccid=9f02eee31b134261&vjs=3
256,Data Analyst-Summer Internship,"Systems Planning and Analysis, Inc.","Alexandria, VA 22311 (Alexandria West End area)","This internship position will assist the Australian Maritime Analysis Group (AMAG) with refining, running and post-processing agent-based models.",5,www.indeed.com/pagead/clk?mo=r&ad=-6NYlbfkN0A9iRlroMm07lYYI3dFCEt8cETOqHrMaOLrsdITsZByvSJGGsIEEccsJw2Nbvm3ZC8zQnYvB-f6CRHH4KO9kU1BJepe2HE9glZhpHYbWbkdz3D96F1Oh0VDCeYitXlJCO-FTmzHaLc2UEb6LY-tQ51b40sucRNbrayNLgbpm01UX4te97cSPxITIqqS-w8XnDObA8eIjq0ChDWP7cG1bm5PL6G6yqDBgEKRdqWrMAYZztkyj3XvbE7E1vF0lVfiVETS8hC0aR93JMNKwDX9WGySotX2mKcjpWSlJOABb6ehbZ_mtWIofk1ZzeNyLmUFM3ixUNcfOYTS95eEDT6MN3b3kC5_Xy8D_6PMlZ8yHJVhWdB2tB5OybonG470n31jQ4UOfCwvzpD192YEvfL_-pHGrrjzDUPzLQsQfeITX12z27WpRkbpzfY3-hbbf4dd0AsZ9dMlOSaAXWbxCoZrtsY8MilPwQ6ipWTXR63jr_olRJSUaHgrzQWK1jSIF0pTAq92paOSUwz5Xtkr1fPjdjcc_hNfmJn7gH34y-WhTCptIRoY5a_BbMtJUD9xrkHl9p_LDVHzueU0P8o_-IzPxenqnjZ3M0SYyffghReoLCIbGDXy_OQToD17q8V-gQ6RQhgeWuhujNLakIzyxmcx2sV5QFbfoS-PUROi5q6Za3VHBjAUNiQnvd-V&p=10&fvj=0&vjs=3
257,Product Strategy Analyst,GEICO,"Alexandria, VA 22311 (Alexandria West End area)",Preference is given to candidates with related work or internship experience. A typical day may include using various programming languages to analyze sales and…,30+,www.indeed.com/cmp/Geico
258,Undergraduate Internship/Co-op Program - Data Scientist,Central Intelligence Agency,"Alexandria, VA 22311 (Alexandria West End area)","As a Data Scientist Undergraduate Intern for the CIA, you will work side-by-side with other Data Scientists to organize and interpret data to inform US decision…",30+,www.indeed.com/pagead/clk?mo=r&ad=-6NYlbfkN0AF-trXmOgtyCwioKtrEl8yaVFL4BmZPgj5ekSBDDCZjYyztgCjYk9Nn1Yk0fikpBCXlbJRto7tbhTNs_8jWhl66WDYF0blksRUITtN7f7We8gX1ulbHIFEbi7O9bLDyp74vfjAdx17fhIKaZ1MUdiR8-dohfXf4dPYOfFIM6iv3IE5UMhpR4Zlr--k394aWMFnTZutI6A70xzYjDNR1TXkRnYMk594nmexiW9Ge0imkA5C82IRWH_5xrKvpqZSecOzL8jIOG0leFwdbKVITIIR9qJ_r_2hYDzQVde4cMBbR6VSte3fw587DbzDcBGnQyurSvnjq45mYjQw8aPgi8xHagZzoDbd4-Cr0YlmEXD-cDtnG04QEiVcW4gMSRbvKAhC52IdG_xkM2gY9eXQNqB2bPK-y7elD8xyQ9NZh9Oj4T4zJi4wrnqxkHiGGEp8MG6KP5KLZ7E1E4lXBZTwJDPOYmo_SOPzQxc22rX1q17VwB732z3tk1U018_PYFPVRpTGvA31IQirCYihHABDvr7T&p=12&fvj=0&vjs=3
259,Data Scientist,Central Intelligence Agency,"Alexandria, VA 22311 (Alexandria West End area)","As a Data Scientist for the CIA, you will organize and interpret data to inform US decision makers, drive successful operations and shape CIA technology and…",30+,www.indeed.com/pagead/clk?mo=r&ad=-6NYlbfkN0AF-trXmOgtyCwioKtrEl8yaVFL4BmZPgj5ekSBDDCZjZycesTIQYxFSJWWs_8HUdDB9hwnbzKrEDmqNEQWLfwRG9GenFiLzX9NjSKXd29GoPxByddGgCwKJYfyC_zQmmOKYurIfyNb0Bi_9DTQbXlY-wGT1MDWens1AdxQPyBrFtaLiJB90EFPE4k5pJy6XerCBh5p9c-AIejvm-zL3vuT6BSxdKZPQz5orBTZDJ7igJDpDHuNXPvV9kNAyZjQiSsjiGzGWOR5jmXrz0bxzfVpL_YN031lkHdMofzyS0oHzDzKfV2ObC2p8IdaAZ2hSbadixIMq0F6U4i7XXnBWJLbdRWxW8aPtMwphLQNwgUQmxLEmUpY6AsvGalCeFedBO5FOGSy1sIPMLK4YyEoJ2iggewZQkuNZnYwJNlaU8T79x_FTwzfMBNXa4_nCt_0Gj4koHObsQHoq8-CA45B2I_MJPNEPLkkWxR-0FGi94DPgYQVoUQnb-dU&p=13&fvj=0&vjs=3
260,Data Scientist - Intern (Summer 2020),"Systems Planning and Analysis, Inc.","Alexandria, VA 22311 (Alexandria West End area)","Experience with preprocessing varied and unstructured data. Experience with common data science tools such as Python, R, or other scripting language.",5,www.indeed.com/pagead/clk?mo=r&ad=-6NYlbfkN0A9iRlroMm07lYYI3dFCEt8cETOqHrMaOLrsdITsZByvSJGGsIEEccsJw2Nbvm3ZC8zQnYvB-f6CZm4ncnQAgJBalJd4epOKCPVLCsz9XApoyvvhkTqjzs7tQ5k5euUtOYu2cf5rIjvaZo3ykQ8-lHGalw9hgnnRyOPfgaQVIfj8vVJ66mZwGhqzR0gOA0H5fl7EsoJrilohzYaTrTYER8tH24bJmS8WUuTcb77_Y2-FhtvI1tAl2XpmNFnRte819XB8vw0Lp_aFG3B1QieUSqQNsZGJ1uPGZ6AzVRgT9BZ73hlTq9BIvoH3_5heAYTgiEW00K0oGt9Tg8T9iLOtqsBJs0nY5cT2tl0ulTL6TMWFwYmAchTXw7jc8qsbanHPqMGLlFoHXJnLsozgtAOSie-QgAUr9GBWwjJNac8O0iHUTmpfNkik1LDZy2bXa9-Yt5yVVPt2IAnbxWRLzb7LuY1CefisLNLcs9JNLHak85FFyqNXL3LrH2JiqdwU9HHS1e9toALotsyQhw-_70JnmS-W4_lV0TLms-FadkBn85d83bCKpfol_hwUH4OFGQBT8FZOQD_ttESyYrRS4SAgDbbgv_YLoAtU_GBLL1_ucwTXTaUbC9GwA7zljbWKdrnXOvm3ql0Wcq0L3mhK_j29lpGI2PcZZdVQB7TdJDCd-JLJF46Rbz4z-BD&p=14&fvj=0&vjs=3
