,Job Title,Company,City,Description,Days On Indeed,URL
423,Data Scientist - Intern (Summer 2020),"Systems Planning and Analysis, Inc.","Alexandria, VA 22311 (Alexandria West area)",Experience with preprocessing varied and unstructured data. This individual will work as a full time intern during the summer semester.,5,www.indeed.com/pagead/clk?mo=r&ad=-6NYlbfkN0A9iRlroMm07lYYI3dFCEt8cETOqHrMaOLrsdITsZByvSJGGsIEEccsJw2Nbvm3ZC8zQnYvB-f6CZm4ncnQAgJBalJd4epOKCPVLCsz9XApoyvvhkTqjzs7tQ5k5euUtOYu2cf5rIjvaZo3ykQ8-lHGalw9hgnnRyOPfgaQVIfj8vVJ66mZwGhqzR0gOA0H5fl7EsoJriloh76GMvkPo5HoNUQgb1zLk1N9lgU1VjpZPh5NBUoa_ozpUY5LQwTXM00SjKcjR5TkdCh25I38mvW3TqL-CcjTxV-5AX1z81aqxKhhQYH11qOBFmdqFY8-z2MpoxCtHG_Qoa2DyTbxRuQK-6kCjIuFP2X1frKNq5KoAByqeuhHJ9ywKIMFDoQTHsqsMlK22HV1JQnHZpqP0Iqr_zqpyVxtJMKxWAt0uY_ayQ64CNDNtMBp2C7g-soeSyqAhRzFwh2svJ3tv6njOA1SwtQfmgTKTDG6-HTh12VG-tQKD_5yja3J0qtB7QZF1NUAfN4UU7ZK85bzYlW1XLVOdHDqswmXXieITvfbf5Oe_uQ7jYXp3upkXj6b37KnyTICgkYsq4eshH59vCi-YiV7PVDg1_EazGV4FyiEOY0kpALIgsgnrPaLOUSPIPoVTHRX-TuUvwBTamToVp_W3Vvj6Bb3pPtrUZeoleH2hZzZvQ==&p=8&fvj=0&vjs=3
424,Undergraduate Internship/Co-op Program - Data Scientist,Central Intelligence Agency,"Alexandria, VA 22311 (Alexandria West area)","As a Data Scientist Undergraduate Intern for the CIA, you will work side-by-side with other Data Scientists to organize and interpret data to inform US decision…",30+,www.indeed.com/cmp/Central-Intelligence-Agency
425,Operations Research Analyst Intern,"Systems Planning and Analysis, Inc.","Alexandria, VA 22311 (Alexandria West area)","Apply innovative concepts, quantitative tools and creative data visualization methods. Working towards a Bachelor’s degree in Engineering, Math, Ops Research,…",5,www.indeed.com/pagead/clk?mo=r&ad=-6NYlbfkN0A9iRlroMm07lYYI3dFCEt8cETOqHrMaOLrsdITsZByvSJGGsIEEccsJw2Nbvm3ZC8zQnYvB-f6CTIUpOaOLLV7KqJKC6L8M3yiqBKHgXradA-B3tGb6D91_SSzq6bwF3j_eRFdcXyXGpBRMva-NZAPVpwf0t-aESaOGlXyEbo2dvYS4rSMP7dspQgHvy0rJ9ztyorpcHWVIuKE-qP0XQGoDNR2ECY51JJR7ml5LRZKuYf15GeYsT48uBOzUqqKSxKbQVOmA0PxlZHuXYr6_BS_2Z5IIoD_NyNDDkzATvOrIwGmlF5IirT0ZbWib1rP7OfVlC7-uCQupkrAIpTa--SNz4lKXOCIf6PbcJSPRfafUpI0qFYZBnC9xXHQpNVYi59VUGcoA3vUYiTqapUH2B5wHIXeBu_zrJhChFioPt1cZx52uQoKmryfVFwxfvk4ThSWS6_AB2lR0k7L8fWFeaY_axKZmrHKXarV1MAOmGLxWReLmifhM9l_PYEz_9XzY_sLLhzq4tRFdzn898K-hPDbK0E4tuz7E1Ey_I6_lD3ODkhHB4un1a_7z71wtsZkmdz9o2qU_leY4R1SFkKU2qiYe77MNBVr-3v5aPq38zG1R5vgKkxCJ4miXn6Wxu9--bAbm6lh4npAopyq5mpvAhwg-GrTbGW2BvdV7VQmwzPL2w==&p=10&fvj=0&vjs=3
426,Operations Research Analyst Intern,"Systems Planning and Analysis, Inc.","Alexandria, VA 22311 (Alexandria West area)","Apply innovative concepts, quantitative tools and creative data visualization methods. Working towards a Bachelor’s degree in Engineering, Math, Ops Research,…",5,www.indeed.com/pagead/clk?mo=r&ad=-6NYlbfkN0A9iRlroMm07lYYI3dFCEt8cETOqHrMaOLrsdITsZByvSJGGsIEEccsJw2Nbvm3ZC8zQnYvB-f6CTIUpOaOLLV7KqJKC6L8M3yiqBKHgXradA-B3tGb6D91_SSzq6bwF3j_eRFdcXyXGpBRMva-NZAPVpwf0t-aESaOGlXyEbo2dvYS4rSMP7dspQgHvy0rJ9ztyorpcHWVIoeV9OjLZxUbJlia6K3g07BWqAYrP5BR3NZdiNKzotsByalYRUWMn8wnINqlX4-aBWP5JFTlnOclgEe3ap3Sg04uw2-gAB-oWDTY3XjnRxN5a4yTMnCA8wB5WMIJlNBcbblUnlL-uriOhZawpo3abnM-UGFePNsso9imZdZ8UKt7U-Rh41I5CM4Kh3BF3AsJQgT39IL19pzn_84nb9MNPiyDe8LSyTkpPj9Z7kq-RnopqEt-_Tb1SHhyyYF6eNa68VFh_QMIVNqyawzldW4L26cE2zTkN8EbmDDar37WMu0Uld-EQeH2cH_1LsK62W_UNEZG5HimHjRSlIuPnnl69puok098BzNNrXx3auiA30alvtid2PFxIGA8f5OdCf5eRHpbqAtLLVeGXp_sikQR4bNone8a8RV9wLlJEiWo10jjPkNAHWKlXMYZHBSoBzLZER2g3ysVWUFVykjofeSgk9K2hmuR-W347A==&p=0&fvj=0&vjs=3
427,Data Analyst-Summer Internship,"Systems Planning and Analysis, Inc.","Alexandria, VA 22311 (Alexandria West area)",The intern will be responsible for the following modeling tasks: (1) developing an understanding of the existing model and data structures (2) coding and…,5,www.indeed.com/pagead/clk?mo=r&ad=-6NYlbfkN0A9iRlroMm07lYYI3dFCEt8cETOqHrMaOLrsdITsZByvSJGGsIEEccsJw2Nbvm3ZC8zQnYvB-f6CRHH4KO9kU1BJepe2HE9glZhpHYbWbkdz3D96F1Oh0VDCeYitXlJCO-FTmzHaLc2UEb6LY-tQ51b40sucRNbrayNLgbpm01UX4te97cSPxITIqqS-w8XnDObA8eIjq0ChKxtGB963kAUblqOhrK1Jh03AdI_NF84pLtbfe7Z-pwvJCEBArCykiKMqTUxGpk4cGtbHwVQiXEb4wtS_FULXSGWrFHlIIyIMh_r5LzGxLGLK_Sae7hLoSffRAvVTKgs3-30r5FmJNZT4DvLik4ATgMAbysCf7RFQsEdWY6qDEk_m1tiCwgaJYhcVH6d_qqObFvCrInWXo_698k36o0h1N-3ZCTQh15_IyDxul50JzPdXOheBlvmHrL3lN3bXO3EunjOwE50Cx25Nf1I3hwBXmf9EyHK6Ienv2rHbrarorkv1YOBg1qq6Njhde9AR3hEwRrRK2t33ph801_EJaFhZN8qR2zca_KZnnF06zLWpY5cIPBiEZsHPBaCiByEsobAP6d6CFb-XNHTSmhat0UHai1wqTw-lCgbrVLxu0WhFHgZPxxruKGb6PopY6M1h3jD_Q3V3quT5zotqx0WqGtdG-4miWXqR6aidg==&p=1&fvj=0&vjs=3
428,Junior Outreach Operations Analyst,"Technical and Management Resources, Inc.","Alexandria, VA 22311 (Alexandria West area)","ITIL or CCA Data Analyst certification. TMR Inc, seeks a Junior Outreach Operations Analyst to support a client located in Washington DC, this candidate will be…",5,www.indeed.com/rc/clk?jk=9a98269fa7eed789&fccid=1a04d9b8760a8419&vjs=3
429,Developer - Intern (Winter 2019),"Systems Planning and Analysis, Inc.","Alexandria, VA 22311 (Alexandria West area)","Experience in data analysis (MATLAB, SAS, S-Plus, R). Ensure tools and code integrates into current analyst processes to improve efficiency.",5,www.indeed.com/rc/clk?jk=367283aeeffd5ec1&fccid=ccfce62820936877&vjs=3
430,Financial Analyst IV,"Naylor, LLC","Alexandria, VA 22311 (Alexandria West area)","As an Analyst IV with Naylor, you will work with our executive team and division leaders to analyze data, costs, and profitability to forecast the company’s…",5,www.indeed.com/rc/clk?jk=277fe976e5aecb7b&fccid=ff8259384edfd871&vjs=3
431,IT Business Analyst (Intern),General Dynamics Information Technology,"Alexandria, VA 22311 (Alexandria West area)","IT Business Analyst Intern Responsibilities. As an intern, you will have real responsibilities and work alongside experienced and innovative industry…",7,www.indeed.com/rc/clk?jk=cce58909185b1270&fccid=11caadcdc98800d4&vjs=3
432,Systems Analyst (Intern),General Dynamics Information Technology,"Alexandria, VA 22311 (Alexandria West area)","GDIT's CIO is seeking a Systems Analyst (Intern) for 2020 in Chantilly, VA. As an intern, you will have real responsibilities and work alongside experienced and…",7,www.indeed.com/rc/clk?jk=001445d09c38d617&fccid=11caadcdc98800d4&vjs=3
433,Cyber Security Analyst Associate (Intern),General Dynamics Information Technology,"Alexandria, VA 22311 (Alexandria West area)",GDIT is seeking a Cybersecurity Intern in Chantilly VA for summer 2020. Our interns have real responsibilities and work alongside experienced leaders and other…,7,www.indeed.com/rc/clk?jk=fbcac6a3f774f746&fccid=11caadcdc98800d4&vjs=3
434,Student Trainee (Economics),US Department of Energy,"Alexandria, VA 22311 (Alexandria West area)","Analyze large volumes of data using SAS, Python or R. Work independently to summarize findings and visually present data. 0199 Social Science Student Trainee.",8,www.indeed.com/rc/clk?jk=e8885571504d5a55&fccid=672f70463e8dc57c&vjs=3
435,Student Trainee (Energy Industry),US Department of Energy,"Alexandria, VA 22311 (Alexandria West area)","Analyze large volumes of data using SAS, Python or R. Work independently to summarize findings and visually present data. Major Duties of the position:",8,www.indeed.com/rc/clk?jk=f080a358bc5aa0d2&fccid=672f70463e8dc57c&vjs=3
436,Web Development Intern - iDeas Lab (Spring 2020),Center For Strategic And International Studies,"Alexandria, VA 22311 (Alexandria West area)","Support the development team with data visualizations, data entry, quality assurance, and bug testing; The internship supports our range of micro-websites and…",11,www.indeed.com/rc/clk?jk=5f10608d2c20a8c0&fccid=a8944406753ba1dc&vjs=3
437,Finance Trainee,US Department of Justice,"Alexandria, VA 22311 (Alexandria West area)","Track data in Microsoft Excel spreadsheets; Research and analyze data, issues, and information that support project recommendations or the work assignments of…",8,www.indeed.com/rc/clk?jk=af125dda66f87294&fccid=a82ba43bbfe2b26b&vjs=3
438,Undergraduate Internship/Co-op Program - Data Scientist,Central Intelligence Agency,"Alexandria, VA 22311 (Alexandria West area)","As a Data Scientist Undergraduate Intern for the CIA, you will work side-by-side with other Data Scientists to organize and interpret data to inform US decision…",30+,www.indeed.com/cmp/Central-Intelligence-Agency
439,Data Scientist - Intern (Summer 2020),"Systems Planning and Analysis, Inc.","Alexandria, VA 22311 (Alexandria West area)",Experience with preprocessing varied and unstructured data. This individual will work as a full time intern during the summer semester.,5,www.indeed.com/pagead/clk?mo=r&ad=-6NYlbfkN0A9iRlroMm07lYYI3dFCEt8cETOqHrMaOLrsdITsZByvSJGGsIEEccsJw2Nbvm3ZC8zQnYvB-f6CZm4ncnQAgJBalJd4epOKCPVLCsz9XApoyvvhkTqjzs7tQ5k5euUtOYu2cf5rIjvaZo3ykQ8-lHGalw9hgnnRyOPfgaQVIfj8vVJ66mZwGhqzR0gOA0H5fl7EsoJriloh7QzvED8GuwaqwPQRRsv1nDIT6CHhR0ya6_Y2UZj2BuWozMw-Sige_Mej8je3sJWeo9vqoK7idmlri7ML-5vqmufxgRcqQEw-St_qeR0CmHS2tfeJG5SJLQnKWxX8r8IeEKPKYiLCOLxfNLpM2ki1zijUx1AjWLOSS_N_2UlbKrzN4K5MipvmTIcaJaK2MsmCSpG5dCnj9mg5XUqAHRSFAPiBEmlQfBaQowT6C9po_7i1AwesisnmZoN9lT2zf-WGQgAdAtmDVWlALKUWWcJ2lgOAf_BaPT3d5nlnHCyQnYqclnC3fBDxvjCj0qrOIBDmMfinklOG-xX6cVXPsBbbGcOcc0k0a8d9mVn9atoNZLsIG276MuAbcZTpZCCjh4aLgbLG6rUkkAWWLD2lY0YOH6cJaORsVe_4vc5QhwU-GvzjLyKVBDRnRuRE52LAC86nZ0rJG2YTPsTFD8A9S4G_obfHxxDWZN-Rg==&p=13&fvj=0&vjs=3
440,Graduate Studies Program - Data Scientist,Central Intelligence Agency,"Alexandria, VA 22311 (Alexandria West area)","As a Data Scientist Graduate Intern for the CIA, you will work side-by-side with other Data Scientists to organize and interpret data to inform US decision…",30+,www.indeed.com/pagead/clk?mo=r&ad=-6NYlbfkN0AF-trXmOgtyCwioKtrEl8yaVFL4BmZPgj5ekSBDDCZjYyztgCjYk9Nn1Yk0fikpBCXlbJRto7tbrtR6ny1gwoDYbGX4DLgV4jACPGKx-78S7ubsJe0cRVFqwrXomGJVxXuVov68Tz-VjWixzObefPCyN4hofwtIqHyq2I1IshXUEvUe2slKEEpSN4XLj12mySa4OChuqFpf3WPR1ln89AiqRADUo4NA3Nu8efQ6tYjXj2c1Br25skMVTP01z1JKPL7Co-rRd7ujB-GrEO-Pj1rSmcsqsm1dpH0eap3ZTA4Ad1ysPn6xLGmJvVEZBip8-jTeDULrybuTrdDFLDCpnLgy9dWa9FUoDDvi5okvK3AenYDhhGnkjZlzFx5uvmPIavptVy-mn7vcEHso9gau7aa9esGyombxMPmTLhIcng25Jej4NncVlk2LK61k28hfjb01WyHJkCoYDfvlrezDGGwsJXKrCNCAu3J77r_arQ7tXciGvue1s91hzKGANyE0SuxUu4HOmZVlLbIOfM_TJ-BaHzqVdWOIkQwexktiB4PTg==&p=14&fvj=0&vjs=3
441,Technology Analyst - Winter Intern,"Systems Planning and Analysis, Inc.","Alexandria, VA 22311 (Alexandria West End area)",Excellent data gathering and analysis skills. Technology Analyst interns will have a unique opportunity to develop cutting edge methodologies for identifying…,5,www.indeed.com/pagead/clk?mo=r&ad=-6NYlbfkN0A9iRlroMm07lYYI3dFCEt8cETOqHrMaOLrsdITsZByvSJGGsIEEccsJw2Nbvm3ZC8zQnYvB-f6CRWNeK4nngNgeecVMVabmghmvOWTSsUjOTwKftYvHIEmKViIkykqF8wEg29BfjbMZkSg6UHAnBVAUyg9anmMPHzmnTE0PNWFmBwy4CaFvL_qqQa-Jj-K47bJOOS1QZKVcC6nizYX0SXn4FtqdOSQj6ECi-JJlqpvm01IC9Y8h6VUTyVOvcqB5a3TmfTZS3LmqQ3gX4zStTGTylwxB9mJQsLtOqCsj1MYRXqoob4A-PaH_h9NqjdadxzmdQlxexziY4YGH6y2bxZbL4vB186DA-Rgtn0ad26H6v2RpbwsEz1ZSIOZl-6FXwNDqD9FHo7UIzACeIu3dGgc96rvWvo-o9YE9rBLLiQvNv13-kbKLIYBa6NbbSvVCyWJ0M-w0aAUtOYizFJ6mRVVSJ8yb47GKb5vmjFK196YAzGkjOkoASpVB3qWBXmoFEwIMYK0Y-U5LNLgv0VzeXhdA7J2XbIWyTMdJLgaGnkJeOaTCI-Cumg8mjgstJze98XZo62icuV_89pSMbCX1Sy9kI46JZthiwt1EKG99sgVB15G0oxR3_qQNZ2K5MCpOkBYtrb31YC60oHi_PWLXAk5XeXRqBW2ogcYTEqZuFyYUA==&p=0&fvj=0&vjs=3
442,Data Analyst-Summer Internship,"Systems Planning and Analysis, Inc.","Alexandria, VA 22311 (Alexandria West End area)",The intern will be responsible for the following modeling tasks: (1) developing an understanding of the existing model and data structures (2) coding and…,5,www.indeed.com/pagead/clk?mo=r&ad=-6NYlbfkN0A9iRlroMm07lYYI3dFCEt8cETOqHrMaOLrsdITsZByvSJGGsIEEccsJw2Nbvm3ZC8zQnYvB-f6CRHH4KO9kU1BJepe2HE9glZhpHYbWbkdz3D96F1Oh0VDCeYitXlJCO-FTmzHaLc2UEb6LY-tQ51b40sucRNbrayNLgbpm01UX4te97cSPxITIqqS-w8XnDObA8eIjq0ChBw6VVjdtiisyzmjblPQ8x5djxh1ef_LLmldzrEBQExMBZj1IwauzReHoszd4YSdnWbO71mWLJUID3FfVxQdmUhsZT2hwKqsMFiR6PNvdCPY57r0IjyQdP-JLXaA6G2-KXmaZ5NZXCGu2X7d9C4ntRB05THz9di_J7wQKkrdP3QaQb8PfB-7qpmaOUML9fx8-HFM5Zz_Rdt2chxMfHo0dP06lEohqEk8VzR0XIBC7kRvsh_Vx4iAiJV5Jl1tR50zdfNv9_yk5AYFOP0-fJ77RV-vAEZUrX9Yxm796sQeZnEidbhJDUYNRbYay3dcNztUGHXTzaOJJzrWcpJ98voUmKMOQFFEcMaIAmfajGu5yMRCI6RzCilPtBa_BkrPnNxDp3MeDvIGCIe9mtn3xsg6uoJoLg9SlTMAisqpImwUwIxNcftubo3ZGuX6--qHEP_cJIONrG-luw9ONZNXLEhUM51yrh1pGzGyIQ==&p=1&fvj=0&vjs=3
443,Undergraduate Internship/Co-op Program - Data Scientist,Central Intelligence Agency,"Alexandria, VA 22311 (Alexandria West End area)","As a Data Scientist Undergraduate Intern for the CIA, you will work side-by-side with other Data Scientists to organize and interpret data to inform US decision…",30+,www.indeed.com/cmp/Central-Intelligence-Agency
444,Operations Research Analyst Intern,"Systems Planning and Analysis, Inc.","Alexandria, VA 22311 (Alexandria West End area)","Apply innovative concepts, quantitative tools and creative data visualization methods. Working towards a Bachelor’s degree in Engineering, Math, Ops Research,…",5,www.indeed.com/pagead/clk?mo=r&ad=-6NYlbfkN0A9iRlroMm07lYYI3dFCEt8cETOqHrMaOLrsdITsZByvSJGGsIEEccsJw2Nbvm3ZC8zQnYvB-f6CTIUpOaOLLV7KqJKC6L8M3yiqBKHgXradA-B3tGb6D91_SSzq6bwF3j_eRFdcXyXGpBRMva-NZAPVpwf0t-aESaOGlXyEbo2dvYS4rSMP7dspQgHvy0rJ9ztyorpcHWVIubW7dCoOVTLMG1s7GKql4sCqhMwNv5r1lCV021Q-woCsgvuQGo_Qr7b9bssrX-Z5X6gBR9WCs8NKO-HdGpbu6uLtV9CkZuOTlDfeJAw47zvWsyvn5xb52N3a9E_elvB6DaxpzN-Ko6gG6Zs1e43cp5tuTPY2K9U7q6i2NrO99Zdso4gBg2-B7XtrO36kj634q5xkvAzu9nvIDfkp93VIYq09NEO2azFYoUxxMn90yLRJS15fQa8jfoTH6qq5p-mQ04UbJoxI8G1ujxJwWW3RY4_Hp74gfZsiOhUaNrM5R6kguUEhbW22zRtEraIuo_2MZXvIf5eVHjhEbBro4aOBp2MeIh4i8KfDvZkfJbCb5ICdhSqHEk_B9HEGK4k6AfqIsMjkxDPaGG_Rk46uBecq3gAe5WLMdfzeB5pmpS8PG_t2VHVMSXFITq9Ly3fD1_Q02_OQ1abUSLVR1NgM7c4g4HTE1pz66Lz2A==&p=3&fvj=0&vjs=3
445,Graduate Studies Program - Data Scientist,Central Intelligence Agency,"Alexandria, VA 22311 (Alexandria West End area)","As a Data Scientist Graduate Intern for the CIA, you will work side-by-side with other Data Scientists to organize and interpret data to inform US decision…",30+,www.indeed.com/pagead/clk?mo=r&ad=-6NYlbfkN0AF-trXmOgtyCwioKtrEl8yaVFL4BmZPgj5ekSBDDCZjYyztgCjYk9Nn1Yk0fikpBCXlbJRto7tbrtR6ny1gwoDYbGX4DLgV4jACPGKx-78S7ubsJe0cRVFqwrXomGJVxXuVov68Tz-VjWixzObefPCyN4hofwtIqHyq2I1IshXUEvUe2slKEEpSN4XLj12mySa4OChuqFpf7Iwx31y52jIdXlgE2CHJcQplpeXp2ukncrMayy3linL80gj_yHIaBtqf5J_UQxpZRbsZHPaCnByGBaCDJclGHHfaUqHzFHreKig4nQjavYbF2PYjup-tno9G3CgjE3wEiGvY6nxTJ2j_0rzZTgAMQ1RgvJ0uU06P7XaNtIhY87T33Sy_zpsvsT-pQ7d1uqEsibFaOkZPrLJGcCIK4KNgjAa6KWbqyf3HGbl8gcPzGH2FF2Kb-K1YLP8CUu3XSARBUKVKmVR677swRK8idOXAyoV9-jXRipjKQoJ3WMgAJqW_HVMx77SKWTMCVCvtnRNu4zakXiYbSyZFYVBzb-e-DPhq5zPuYsx5g==&p=4&fvj=0&vjs=3
446,Web Development Intern - iDeas Lab (Spring 2020),Center For Strategic And International Studies,"Alexandria, VA 22311 (Alexandria West End area)","Support the development team with data visualizations, data entry, quality assurance, and bug testing; The internship supports our range of micro-websites and…",11,www.indeed.com/rc/clk?jk=5f10608d2c20a8c0&fccid=a8944406753ba1dc&vjs=3
447,Student Trainee (Operations Research Analyst),US Department of the Army,"Alexandria, VA 22311 (Alexandria West End area)",About the Position: Position(s) will be filled under the Department of the Army Pathways Intern Program. This intern position is designed to prepare a student…,11,www.indeed.com/rc/clk?jk=986e49cdffe88804&fccid=c3b8389ba1f05d96&vjs=3
448,Salesforce Administrator,DonorSearch,"Alexandria, VA 22311 (Alexandria West End area)",We are looking for an enthusiastic marketing intern to join our marketing department and provide creative ideas to help achieve our goals.,10,www.indeed.com/rc/clk?jk=4c2c577ea33eedd9&fccid=ba50dc138679d168&vjs=3
449,Student Trainee (Financial Managment),US Department of the Army,"Alexandria, VA 22311 (Alexandria West End area)",Examine budgets to verify the reasonableness and adequacy of supporting data. Perform duties such as supporting Accountants and Budget Analyst with various…,11,www.indeed.com/rc/clk?jk=fd62fc9dab90fe05&fccid=c3b8389ba1f05d96&vjs=3
450,Senior Digital Forensic Analyst/Investigator,"Focused Cyber, LLC","Alexandria, VA 22311 (Alexandria West End area)",Recover information from computers and data storage devices. Familiarity using forensic tools and investigative methods to locate specific electronic data.,7,www.indeed.com/rc/clk?jk=52b274672f19403b&fccid=4a5a1124d25f8bc3&vjs=3
451,Student Trainee (Financial Management),US Department of the Army,"Alexandria, VA 22311 (Alexandria West End area)",Examine budgets to verify the reasonableness and adequacy of supporting data. Perform duties such as supporting Accountants and Budget Analyst with various…,11,www.indeed.com/rc/clk?jk=feb1b55e33cc574c&fccid=c3b8389ba1f05d96&vjs=3
452,"Policy Analyst, Center on Poverty and Inequality - Georgetow...",Georgetown University,"Alexandria, VA 22311 (Alexandria West End area)","Conduct literature reviews, data collection, analysis, interpretation, visualization, and communication. Policy Analyst, Center on Poverty and Inequality -…",15,www.indeed.com/rc/clk?jk=dafed8cc8e08059f&fccid=fb19e26fb0900ff5&vjs=3
453,"Undergraduate Intern, Corporate Financing",Finra,"Alexandria, VA 22311 (Alexandria West End area)","Intern will perform a variety of research, analytical, and administrative duties to support the Corporate Financing Department in its surveillance of private…",18,www.indeed.com/rc/clk?jk=2e6497eab3874377&fccid=b7e7351d21700e06&vjs=3
454,Analyst - Artificial Intelligence & PoS Platforms,AskBlue,"Alexandria, VA 22311 (Alexandria West End area)",Streaming Data and Messaging. Job Title: Analyst - Artificial Intelligence & PoS Platforms. Ensure Guest Data is always encrypted at rest and in transit.,17,www.indeed.com/company/AskBlue/jobs/Analyst-263da4419248c9f2?fccid=3f8c6c29ae3780e9&vjs=3
455,"Undergraduate Intern - Fraud Surveillance- Business, Finance...",Finra,"Alexandria, VA 22311 (Alexandria West End area)","The intern will assist analysts and managers with the investigative processes, including analysis of surveillance alerts, trade data and other evidence obtained…",16,www.indeed.com/rc/clk?jk=62a75e876b76e954&fccid=b7e7351d21700e06&vjs=3
456,Data Scientist - Intern (Summer 2020),"Systems Planning and Analysis, Inc.","Alexandria, VA 22311 (Alexandria West End area)",Experience with preprocessing varied and unstructured data. This individual will work as a full time intern during the summer semester.,5,www.indeed.com/pagead/clk?mo=r&ad=-6NYlbfkN0A9iRlroMm07lYYI3dFCEt8cETOqHrMaOLrsdITsZByvSJGGsIEEccsJw2Nbvm3ZC8zQnYvB-f6CZm4ncnQAgJBalJd4epOKCPVLCsz9XApoyvvhkTqjzs7tQ5k5euUtOYu2cf5rIjvaZo3ykQ8-lHGalw9hgnnRyOPfgaQVIfj8vVJ66mZwGhqzR0gOA0H5fl7EsoJriloh4iCsJ9uVpOOrZCUaXVX4ns3SvDvAcOxr3Uh12v_j1gf1rlpxImmbS7RFQ8WLqTMZSg5ugfIivPUF1pegVyckpeP2oLwmT_iTGMc07Tx3g-MnfVfTblKhPi-31i-suM9t3qT9FadbhTpuYvM3KzyuJmhX-mjmupK3V_MQTO___4cskAvoGlVbv-fq9l32ICHfUeshXfz5ah3viFsD0Tw1S_sWPywO-h-guuNTu-So8QpER5wyl6RPmcDVeupVZRZlEGbFnUQuKnc8RmZjNJgo_kckX-sqo1MoEOx5MsCkVUaOQVDgbiZMc7KoYyIaOBNAvnZ8O98F6trgzm-E2pqIN6kQZuDcImmvA2_bJu0PvKLiloW2YzSWXkldwY2F3vXimGoqWshhAE6Fx38WKBHqN2fKGM1IBssyl4IQOmRMVwfi72OH25JpeicoIsd_t3vJi7mbaILKpS72rVenco5Do4KOtZ74TnQyQ==&p=15&fvj=0&vjs=3
457,Graduate Studies Program - Data Scientist,Central Intelligence Agency,"Washington, DC","As a Data Scientist Graduate Intern for the CIA, you will work side-by-side with other Data Scientists to organize and interpret data to inform US decision…",30+,www.indeed.com/cmp/Central-Intelligence-Agency
458,Operations Research Analyst Intern,"Systems Planning and Analysis, Inc.","Washington, DC","Apply innovative concepts, quantitative tools and creative data visualization methods. Working towards a Bachelor’s degree in Engineering, Math, Ops Research,…",5,www.indeed.com/pagead/clk?mo=r&ad=-6NYlbfkN0A9iRlroMm07lYYI3dFCEt8cETOqHrMaOLrsdITsZByvSJGGsIEEccsJw2Nbvm3ZC8zQnYvB-f6CTIUpOaOLLV7KqJKC6L8M3yiqBKHgXradA-B3tGb6D91_SSzq6bwF3j_eRFdcXyXGpBRMva-NZAPVpwf0t-aESaOGlXyEbo2dvYS4rSMP7dspQgHvy0rJ9ztyorpcHWVImww-FSAHko4hWBFcF65snmBAFCo-Pz6fv8qYTdfPaEZ7Z5SOw0WoQ6omgt-hulBdKNPjIqGHwdynbf4U1UjlUbQfCPRadzFwS7EhWLrGrCDwzcF_f_yUbMK4F92OaxzQCutO8hdBta11Lr7smlrgf4QyDkwXiULOtfT41sRhgu5UhzCPDsqXuht9zDaDnMThcjAOnbskrGN5D4q7iJWnnTyCuvZyEqcnzTFZSq2gJPbp2lVGltne3d7cbStIymiZb-j32fcui1jmrlDDcdFuUIKbESfhBhLyoZ14D1I8buVZN67CBjCk_P6yWQUU6lWjrGcwt2J2HfJiF8D6v1taVPJEaFyQ5UTqdVVBl02FSWcNfhAxBaaXuFF10bEKi5Z4BQEpB17A3rwE2znNkfH83KW7Br6iqfPNl_UbXhstIxc8XBNNwQsJYbfX6bGzgCdxfKnIFllqAXWpkNCeULN3Ea-ZmEtxIvysw==&p=1&fvj=0&vjs=3
459,Data Analyst-Summer Internship,"Systems Planning and Analysis, Inc.","Washington, DC",The intern will be responsible for the following modeling tasks: (1) developing an understanding of the existing model and data structures (2) coding and…,5,www.indeed.com/pagead/clk?mo=r&ad=-6NYlbfkN0A9iRlroMm07lYYI3dFCEt8cETOqHrMaOLrsdITsZByvSJGGsIEEccsJw2Nbvm3ZC8zQnYvB-f6CRHH4KO9kU1BJepe2HE9glZhpHYbWbkdz3D96F1Oh0VDCeYitXlJCO-FTmzHaLc2UEb6LY-tQ51b40sucRNbrayNLgbpm01UX4te97cSPxITIqqS-w8XnDObA8eIjq0ChEFmj5YoOQkpEMIrWbFH-zqDxjxO2lOzIm2DTJM9pa_vKa7-tKp2XejzJ-23eRpqNK81M8JoV9i9MDKTChZOrzRccZ79Sk-yZU-CfzMguXNaIduPJAk3Q2LdRyAZ6oLM_Fc_s3oLFr85UxKxkpy1qx-R-JcjvzRj-7Z7_5ZorNoT0eIYYFeXu7sAxn441F-pYljA3QAkPogczNptBSNLq9hPDo62egua31QW9SruRlM_D182iQ_bkBVvzZhaO130O3XuvogBuQQu4x97P94oVznwqv4UgwmWgiHVRmjGwI_E3N4H-1R2d0Z_NtJX4BDgnQGsImuyfrTpDIP_7P1JOd4_O65FBUnZyhQwNFAVSl0eCj92BsMI53NB07D0iaAqobZ0dXZJ-QFHxdystQsYFGUB6N5j0TQWWmKpNI3Gmd-I-62wVpum2d-8uuucboYKPDXsUGD0F2XnNl5iXB1CbiuY00ExCvJKLg==&p=2&fvj=0&vjs=3
460,Data Scientist - Intern (Summer 2020),"Systems Planning and Analysis, Inc.","Washington, DC",Experience with preprocessing varied and unstructured data. This individual will work as a full time intern during the summer semester.,5,www.indeed.com/pagead/clk?mo=r&ad=-6NYlbfkN0A9iRlroMm07lYYI3dFCEt8cETOqHrMaOLrsdITsZByvSJGGsIEEccsJw2Nbvm3ZC8zQnYvB-f6CZm4ncnQAgJBalJd4epOKCPVLCsz9XApoyvvhkTqjzs7tQ5k5euUtOYu2cf5rIjvaZo3ykQ8-lHGalw9hgnnRyOPfgaQVIfj8vVJ66mZwGhqzR0gOA0H5fl7EsoJriloh1YXe1p98PI98GCcmqGQS7No6mAuqfXZxLzlsvEygZP9fI_os-us6adsEWO9G_C_KpupOdydK-3JBn8sd6ImKGnV8cSuarUOtsfqvu8LuRkgr7FlmKfxZ801rp8i2zGR4w4BJNJkkVDiXUCplNQH4vk14vqRW2-x2t14wS6Llq3tgWbkjcOGC0mt7uH9v788NV8svKGroLviQkp60uC8uAGwGXQ0nLhnfWpyKVkqjPhCxD6G1_S-YdU9lFIIx4vv3l1cQrWrMEb1gE0hrccGO1pu_XUInGdVguPHS5IELIczy1fv1jdqXMAVUkJTnAYWdwU1SqhB0paPe-60N2inTIE-JuP2tFos9Ex-dGzEdfpO_csaq2185ajtw4VckDck6OfipufCmM6Dvh51A-6QJ2tq1aLuWK_VBkswPsbKMAG2_a9_40L12JPFaBxcC5CD0rBuD6Sp7ZKbuA_yBxCbxmQwifADn8zvYA==&p=3&fvj=0&vjs=3
461,Undergraduate Internship/Co-op Program - Data Scientist,Central Intelligence Agency,"Washington, DC","As a Data Scientist Undergraduate Intern for the CIA, you will work side-by-side with other Data Scientists to organize and interpret data to inform US decision…",30+,www.indeed.com/pagead/clk?mo=r&ad=-6NYlbfkN0AF-trXmOgtyCwioKtrEl8yaVFL4BmZPgj5ekSBDDCZjYyztgCjYk9Nn1Yk0fikpBCXlbJRto7tbhTNs_8jWhl66WDYF0blksRUITtN7f7We8gX1ulbHIFEbi7O9bLDyp74vfjAdx17fhIKaZ1MUdiR8-dohfXf4dPYOfFIM6iv3IE5UMhpR4Zlr--k394aWMHenjUwADr2PzmXcJA_DfbZDK16LxjvOUYqgSTIm3nCHgZ1wW1QL8aQ84zNTCO2oBSnw8dkK5TpGJVSwb5vwHLomOohEZCyjvLtoiC4SeZBcbrfIGKJ0rXWIAqglm-2Icl6MRmjsfvI335GVd0CkbV71A5LNEbZa0W4EEfwu1Vi8I9Fup1QonfLiDukmbWvK0WmkBsGlETTWKqBEhcA8DwEpON842MePJLsolId2B8yfzMpaGU280Kr3waN1FXynKVpYxiWP9v-ZKTPAp0axcwjgWKeNOoz_QVVFTqj5XZBUPI4jm8bQAjdxyQwGyMbjTQcFKjXiwJHFReiMBT63Gn0&p=4&fvj=0&vjs=3
462,Incident /Cyber Response Analyst TS/SCI preferred,"Focused Cyber, LLC","Washington, DC",Utilizes data analytics tools including Splunk to make sense of machine data in performing responsibilities. Incident Response personnel investigate and analyze…,18,www.indeed.com/rc/clk?jk=71f839826aa5b256&fccid=4a5a1124d25f8bc3&vjs=3
463,Data Analytics and Visualization Specialist,Reingold Inc,"Washington, DC",Reingold is hiring an early-career (2+ years) data analyst with a specialty in data visualization tools to join our team.,22,www.indeed.com/rc/clk?jk=61d745e9536838aa&fccid=235faca8bf78ed41&vjs=3
464,Data Security Analyst VA,"Focused Cyber, LLC","Washington, DC","Functional Responsibility: Maintains systems to protect data from unauthorized users. To apply for this position, you must have an active Top Secret Clearance.",25,www.indeed.com/rc/clk?jk=25f3f5f1ab008f1e&fccid=4a5a1124d25f8bc3&vjs=3
465,Policy Analyst -Federal Fiscal Policy,Center on Budget & Policy,"Washington, DC",Experience working with survey data and/or statistical packages is a plus but not required. The Center on Budget and Policy Priorities seeks a Policy Analyst to…,22,www.indeed.com/rc/clk?jk=333a04aa711a01f5&fccid=15792522ec488a38&vjs=3
466,Policy Analyst – Federal Fiscal Policy,Center on Budget and Policy Priorities,"Washington, DC",Experience working with survey data and/or statistical packages is a plus but not required. The Center on Budget and Policy Priorities seeks a Policy Analyst to…,22,www.indeed.com/rc/clk?jk=5e98214626b58175&fccid=990692592d4960c2&vjs=3
467,Intern - Risk and Foresight Group (Spring 2020),Center For Strategic And International Studies,"Washington, DC",This intern is principally responsible for providing research into emerging global risks and trends for use in Risk and Foresight Group materials.,28,www.indeed.com/rc/clk?jk=fba0860edc25a232&fccid=a8944406753ba1dc&vjs=3
468,Technology Analyst - Intern,Systems Planning and Analysis,"Washington, DC",Excellent data gathering and analysis skills. Technology Analyst interns will have a unique opportunity to develop cutting edge methodologies for identifying…,30+,www.indeed.com/rc/clk?jk=70056734653b51d6&fccid=ccfce62820936877&vjs=3
469,Legal Research Data Assistant – Healthcare Fraud Unit – Crim...,CACI,"Washington, DC",Perform legal and administrative duties as requested by the Data Analyst Team. Experience as a Research Assistant/Research Intern. What You’ll Get to Do:,30+,www.indeed.com/rc/clk?jk=9e7678a9bc57f638&fccid=290a4498a64fc044&vjs=3
